[
  {
    "id": "topic:arbeidsmarkt",
    "slug": "arbeidsmarkt",
    "name": "Arbeidsmarkt",
    "description": "Arbeidsmarkt gaat over werkgelegenheid, arbeidsvoorwaarden, participatie, uitkeringen en pensioenen. Verantwoordelijk zijn de minister van Sociale Zaken en Werkgelegenheid en de minister van Werk en Participatie, met UWV, SVB en de Nederlandse Arbeidsinspectie als uitvoering.",
    "organizations": [
      "org:ministerie-van-sociale-zaken-en-werkgelegenheid",
      "org:zbo-uitvoeringsinstituut-werknemersverzekeringen",
      "org:zbo-sociale-verzekeringsbank",
      "org:nederlandse-arbeidsinspectie",
      "org:sociaal-economische-raad",
      "org:uitvoering-van-beleid",
      "org:rwt-inlichtingenbureau-ib",
      "org:zbo-stichting-blik-op-werk",
      "org:zbo-pensioen-en-uitkeringsraad",
      "org:zbo-bedrijfstakpensioenfondsen"
    ],
    "positions": [
      "pos:minister-van-sociale-zaken-en-werkgelegenheid",
      "pos:minister-van-werk-en-participatie"
    ],
    "keywords": [
      "arbeidsmarkt",
      "werkgelegenheid",
      "werknemer",
      "werkgever",
      "werkenden",
      "vacature",
      "vacatures",
      "banen",
      "salaris",
      "loon",
      "loonsverhoging",
      "cao",
      "pensioen",
      "uitkering",
      "bijstand",
      "staking",
      "vakbond",
      "fnv",
      "cnv",
      "personeelstekorten",
      "werkloosheid",
      "minimumloon"
    ],
    "sources": [
      {
        "source": "src:k-onderwerp-arbeidsmarkt",
        "retrieved": "2026-09-19",
        "confidence": "high"
      }
    ]
  },
  {
    "id": "topic:asiel-en-migratie",
    "slug": "asiel-en-migratie",
    "name": "Asiel en migratie",
    "description": "Asiel en migratie gaat over asielprocedures, de opvang van asielzoekers, gezinshereniging en terugkeer. Verantwoordelijk zijn de minister van Asiel en Migratie en de staatssecretaris van Justitie en Veiligheid, met de IND, het COA en de DT&V als uitvoering.",
    "organizations": [
      "org:ministerie-van-justitie-en-veiligheid",
      "org:immigratie-en-naturalisatiedienst",
      "org:zbo-centraal-orgaan-opvang-asielzoekers",
      "org:dienst-identificatie-en-screening-asielzoekers",
      "org:dienst-terugkeer-en-vertrek",
      "org:zbo-stichting-nidos",
      "org:adviesraad-migratie",
      "org:zbo-nationaal-rapporteur-mensenhandel-en-seksueel-geweld-tegen-kinderen",
      "org:nationale-opvang-organisatie"
    ],
    "positions": [
      "pos:minister-van-asiel-en-migratie",
      "pos:staatssecretaris-van-justitie-en-veiligheid"
    ],
    "keywords": [
      "asiel",
      "asielzoeker",
      "asielzoekers",
      "asielzoekerscentrum",
      "azc",
      "asielopvang",
      "asielaanvraag",
      "migratie",
      "vluchteling",
      "vluchtelingen",
      "opvang",
      "noodopvang",
      "opvanglocatie",
      "opvangcentrum",
      "spreidingswet",
      "dwangsom",
      "coa",
      "immigratiedienst",
      "gezinshereniging",
      "inburgering",
      "statushouder",
      "asielcrisis",
      "uitzetting",
      "mensenhandel"
    ],
    "sources": [
      {
        "source": "src:k-onderwerp-asiel-en-migratie",
        "retrieved": "2026-09-19",
        "confidence": "high"
      }
    ]
  },
  {
    "id": "topic:infrastructuur",
    "slug": "infrastructuur",
    "name": "Infrastructuur",
    "description": "Infrastructuur gaat over wegen, spoor, water, scheepvaart, luchtvaart en openbaar vervoer. Verantwoordelijk zijn de minister en de staatssecretaris van Infrastructuur en Waterstaat, met Rijkswaterstaat en het KNMI als uitvoering.",
    "organizations": [
      "org:ministerie-van-infrastructuur-en-waterstaat",
      "org:rijkswaterstaat",
      "org:koninklijk-nederlands-meteorologisch-instituut",
      "org:inspectie-leefomgeving-en-transport",
      "org:zbo-rdw",
      "org:zbo-centraal-bureau-rijvaardigheidsbewijzen",
      "org:rwt-prorail-bv",
      "org:zbo-luchtverkeersleiding-nederland",
      "org:zbo-nederlandse-loodsencorporatie",
      "org:waterschap-van-rijnland",
      "org:waterschap-rijn-en-ijssel",
      "org:provincie-utrecht"
    ],
    "positions": [
      "pos:minister-van-infrastructuur-en-waterstaat",
      "pos:staatssecretaris-van-infrastructuur-en-waterstaat",
      "pos:rijkswaterstaat-directeur-generaal"
    ],
    "keywords": [
      "infrastructuur",
      "wegen",
      "snelweg",
      "verkeer",
      "trein",
      "spoor",
      "spoorlijn",
      "spoorwegen",
      "openbaar vervoer",
      "bus",
      "metro",
      "fietspad",
      "brug",
      "tunnel",
      "sluis",
      "dijk",
      "auto",
      "automobilisten",
      "vrachtwagen",
      "schiphol",
      "luchthaven",
      "luchtvaart",
      "vliegtuig",
      "haven",
      "prorail",
      "rijkswaterstaat",
      "verkeersveiligheid"
    ],
    "sources": [
      {
        "source": "src:k-onderwerp-infrastructuur",
        "retrieved": "2026-09-19",
        "confidence": "high"
      }
    ]
  },
  {
    "id": "topic:klimaat-en-energie",
    "slug": "klimaat-en-energie",
    "name": "Klimaat en energie",
    "description": "Klimaat en energie gaat over klimaatbeleid, de energietransitie, het volle stroomnet, kernenergie en de verduurzaming van de industrie. Verantwoordelijk zijn de minister en de staatssecretaris van Klimaat en Groene Groei en de minister van Economische Zaken en Klimaat.",
    "organizations": [
      "org:ministerie-van-economische-zaken-en-klimaat",
      "org:nederlandse-emissieautoriteit",
      "org:rijksdienst-voor-ondernemend-nederland",
      "org:staatstoezicht-op-de-mijnen",
      "org:planbureau-voor-de-leefomgeving",
      "org:zbo-autoriteit-consument-en-markt",
      "org:koninklijk-nederlands-meteorologisch-instituut",
      "org:zbo-instituut-mijnbouwschade-groningen",
      "org:zbo-nederlandse-organisatie-voor-toegepast-natuurwetenschappelijk-onderzoek"
    ],
    "positions": [
      "pos:minister-van-klimaat-en-groene-groei",
      "pos:staatssecretaris-van-klimaat-en-groene-groei",
      "pos:minister-van-economische-zaken-en-klimaat"
    ],
    "keywords": [
      "klimaat",
      "klimaatverandering",
      "klimaatdoelen",
      "energie",
      "energierekening",
      "energietransitie",
      "gas",
      "aardgas",
      "gaswinning",
      "gasprijs",
      "elektriciteit",
      "stroom",
      "stroomnet",
      "netcongestie",
      "netbeheerder",
      "waterstof",
      "groningen",
      "zonnepark",
      "kernenergie",
      "windenergie",
      "verduurzaming"
    ],
    "sources": [
      {
        "source": "src:k-onderwerp-klimaat-en-energie",
        "retrieved": "2026-09-19",
        "confidence": "high"
      }
    ]
  },
  {
    "id": "topic:koninkrijksrelaties",
    "slug": "koninkrijksrelaties",
    "name": "Koninkrijksrelaties",
    "description": "Koninkrijksrelaties gaat over de verhoudingen tussen Nederland en Aruba, Curaçao en Sint Maarten en over het bestuur van Caribisch Nederland. Verantwoordelijk is de staatssecretaris Koninkrijksrelaties en Slagvaardige Overheid bij het ministerie van Binnenlandse Zaken en Koninkrijksrelaties.",
    "organizations": [
      "org:ministerie-van-binnenlandse-zaken-en-koninkrijksrelaties",
      "org:openbaar-lichaam-bonaire",
      "org:openbaar-lichaam-saba",
      "org:openbaar-lichaam-sint-eustatius",
      "org:rijksvertegenwoordiger-bes",
      "org:zbo-kamer-van-koophandel-en-nijverheid-bonaire",
      "org:zbo-kamer-van-koophandel-en-nijverheid-sint-eustatius-en-saba",
      "org:rwt-distributeurs-van-elektriciteit-en-drinkwater-zoals-bedoeld-in-de-wet-elektricit",
      "org:ministerie-van-buitenlandse-zaken"
    ],
    "positions": [
      "pos:staatssecretaris-koninkrijksrelaties-en-slagvaardige-overheid",
      "pos:minister-van-binnenlandse-zaken-en-koninkrijksrelaties",
      "pos:gezaghebber-bonaire",
      "pos:gezaghebber-saba",
      "pos:gezaghebber-sint-eustatius",
      "pos:rijksvertegenwoordiger-bes"
    ],
    "keywords": [
      "koninkrijksrelaties",
      "rijkswet",
      "landspakket",
      "aruba",
      "curacao",
      "curaçao",
      "sint maarten",
      "sint-maarten",
      "bonaire",
      "sint eustatius",
      "saba",
      "caribisch",
      "gouverneur",
      "rijksvertegenwoordiger",
      "eilandsraad",
      "gezaghebber"
    ],
    "sources": [
      {
        "source": "src:k-onderwerp-koninkrijksrelaties",
        "retrieved": "2026-09-19",
        "confidence": "high"
      }
    ]
  },
  {
    "id": "topic:onderwijs",
    "slug": "onderwijs",
    "name": "Onderwijs",
    "description": "Onderwijs gaat over primair en voortgezet onderwijs, beroepsonderwijs, hoger onderwijs en wetenschap. Verantwoordelijk zijn de minister van Onderwijs, Cultuur en Wetenschap en de staatssecretaris Onderwijs en Emancipatie, met DUO en de Onderwijsinspectie als uitvoering.",
    "organizations": [
      "org:ministerie-van-onderwijs-cultuur-en-wetenschap",
      "org:dienst-uitvoering-onderwijs",
      "org:inspectie-van-het-onderwijs",
      "org:onderwijsraad",
      "org:zbo-college-voor-toetsen-en-examens",
      "org:zbo-nederlandse-organisatie-voor-wetenschappelijk-onderzoek",
      "org:zbo-koninklijke-nederlandse-akademie-van-wetenschappen",
      "org:zbo-samenwerkingsorganisatie-beroepsonderwijs-bedrijfsleven",
      "org:nationaal-archief",
      "org:zbo-nederlands-vlaamse-accreditatieorganisatie"
    ],
    "positions": [
      "pos:minister-van-onderwijs-cultuur-en-wetenschap",
      "pos:staatssecretaris-onderwijs-en-emancipatie"
    ],
    "keywords": [
      "onderwijs",
      "school",
      "scholen",
      "basisschool",
      "leerlingen",
      "scholieren",
      "student",
      "studenten",
      "universiteit",
      "universiteiten",
      "hogeschool",
      "hogescholen",
      "mbo",
      "duo",
      "studie",
      "praktijkonderwijs",
      "examen",
      "lerarentekort",
      "docent",
      "leraar",